{
  "$schema": "http://json-schema.org/draft-07/schema#",
  "title": "Canonical Health Event",
  "description": "Neutral intermediate representation for the Progressive Harmonization ETL framework. Each event represents one atomic observation, measurement, or health-related data point, regardless of source.",
  "type": "object",
  "required": [
    "event_id",
    "subject_id",
    "timestamp",
    "type",
    "category",
    "payload",
    "context",
    "provenance",
    "mapping",
    "quality",
    "stage"
  ],
  "additionalProperties": false,
  "properties": {
    "event_id": {
      "type": "string",
      "format": "uuid",
      "description": "Globally unique identifier for this canonical event (UUID v4)."
    },
    "subject_id": {
      "type": "string",
      "description": "Pseudonymized subject identifier. Mapped from source-specific user IDs during ingestion."
    },
    "timestamp": {
      "type": "string",
      "format": "date-time",
      "description": "ISO 8601 timestamp marking the start or occurrence time of the event. For point-in-time measurements, this is the measurement time. For periods, this is the period start."
    },
    "timestamp_end": {
      "type": ["string", "null"],
      "format": "date-time",
      "description": "ISO 8601 timestamp marking the end of a period. Null for point-in-time events.",
      "default": null
    },
    "duration_seconds": {
      "type": ["number", "null"],
      "minimum": 0,
      "description": "Duration in seconds. Provided when the source supplies duration directly or derivable from timestamp/timestamp_end. Null for instantaneous events.",
      "default": null
    },
    "type": {
      "type": "string",
      "enum": ["measurement", "observation", "survey", "event", "summary", "session"],
      "description": "Broad event classification. 'measurement' for quantitative device readings. 'observation' for qualitative or contextual data. 'survey' for questionnaire responses. 'event' for discrete occurrences. 'summary' for aggregated/derived values. 'session' for data spanning a defined activity period (e.g., sleep session)."
    },
    "category": {
      "type": "string",
      "description": "Source-derived category describing what is being measured. Uses the source's own terminology without semantic interpretation. Examples: 'steps', 'heart-rate', 'sleep', 'calories'. Not a controlled vocabulary -- standardization happens in the mapping stage.",
      "minLength": 1
    },
    "granularity": {
      "type": "string",
      "enum": ["instant", "interval", "daily", "session", "unknown"],
      "description": "Temporal granularity of this event. 'instant' for point-in-time. 'interval' for fixed-width time buckets (e.g., 15-min intraday). 'daily' for day-level summaries. 'session' for variable-length activity periods. 'unknown' when granularity cannot be determined.",
      "default": "unknown"
    },
    "payload": {
      "type": "object",
      "description": "The measurement data. After decomposition, most events have a scalar value. Complex/composite events use raw_value for structured data.",
      "required": ["raw_value"],
      "additionalProperties": false,
      "properties": {
        "value": {
          "type": ["number", "string", "boolean", "null"],
          "description": "The primary scalar value of this event after extraction. Numeric for most measurements (steps=258, heart_rate=72). String for categorical data. Null for composite events where meaning is in raw_value or components."
        },
        "raw_value": {
          "description": "The original value as extracted from the source for this specific event. For atomic events this may equal 'value' (as its original type). For composite events, this contains the structured sub-object. Preserves original types (string '3475' stays string)."
        },
        "unit": {
          "type": ["string", "null"],
          "description": "Unit of measurement. Null when the source does not specify units. Populated by the adapter when units are implicit (e.g., Fitbit steps -> 'count', distance -> 'km'). Not yet standardized -- UCUM normalization happens in the cleaning stage.",
          "default": null
        },
        "label": {
          "type": ["string", "null"],
          "description": "Human-readable label for the measurement as provided by or derived from the source. Examples: 'Daily Step Count', 'Resting Heart Rate'. Used for display and as input to semantic mapping.",
          "default": null
        },
        "components": {
          "type": ["array", "null"],
          "description": "For multi-component observations (e.g., a heart rate zone has name+min+max+minutes+calories). Each component is a named value. Null for simple scalar events.",
          "default": null,
          "items": {
            "type": "object",
            "required": ["name", "value"],
            "additionalProperties": false,
            "properties": {
              "name": {
                "type": "string",
                "description": "Component name from the source (e.g., 'min', 'max', 'minutes', 'caloriesOut')."
              },
              "value": {
                "description": "Component value, any JSON type."
              },
              "unit": {
                "type": ["string", "null"],
                "description": "Unit for this component, if different from the parent event's unit."
              }
            }
          }
        }
      }
    },
    "context": {
      "type": "object",
      "description": "Source and device metadata. Identifies where the data came from without semantic interpretation.",
      "required": ["source", "modality"],
      "additionalProperties": false,
      "properties": {
        "source": {
          "type": "string",
          "description": "Identifier for the data source system (e.g., 'fitbit', 'withings', 'flexai')."
        },
        "device": {
          "type": ["string", "null"],
          "description": "Specific device model if known (e.g., 'Fitbit Charge 6', 'Withings Body+').",
          "default": null
        },
        "modality": {
          "type": "string",
          "enum": ["wearable", "scale", "survey", "sensor", "app", "game", "vr", "unknown"],
          "description": "Data collection modality."
        },
        "source_measurement_type": {
          "type": ["string", "null"],
          "description": "The original measurementType or data type identifier from the source, verbatim. For Fitbit: 'steps', 'heart-rate-intraday', 'sleep-log'. Preserves source terminology for debugging and reprocessing.",
          "default": null
        }
      }
    },
    "provenance": {
      "type": "object",
      "description": "Traceability back to the original source record. Enables reprocessing and auditing without duplicating raw data in every event.",
      "required": ["source_record_id", "ingested_at"],
      "additionalProperties": false,
      "properties": {
        "source_record_id": {
          "type": "string",
          "description": "Identifier or hash of the original source record from which this event was derived. Used to look up the raw record in the raw data store."
        },
        "group_id": {
          "type": ["string", "null"],
          "format": "uuid",
          "description": "Shared identifier among all canonical events derived from the same source record. Enables retrieval of sibling events. Null if the source record produces exactly one event.",
          "default": null
        },
        "parent_event_id": {
          "type": ["string", "null"],
          "format": "uuid",
          "description": "Reference to a parent canonical event. Used for intraday events pointing to their daily summary, or sleep stage events pointing to their sleep session. Null for top-level events.",
          "default": null
        },
        "ingested_at": {
          "type": "string",
          "format": "date-time",
          "description": "ISO 8601 timestamp of when this event was created by the ingestion layer."
        },
        "adapter": {
          "type": ["string", "null"],
          "description": "Identifier of the source adapter that produced this event (e.g., 'fitbit-charge6-v1'). Enables versioned reprocessing.",
          "default": null
        },
        "adapter_version": {
          "type": ["string", "null"],
          "description": "Semantic version of the adapter used (e.g., '1.0.0').",
          "default": null
        }
      }
    },
    "mapping": {
      "type": "object",
      "description": "Semantic mapping to standard terminologies. Null/empty at ingestion, populated during the Mapping stage of the pipeline.",
      "additionalProperties": false,
      "properties": {
        "standard_code": {
          "type": ["string", "null"],
          "description": "Code in the target standard vocabulary (e.g., LOINC '55423-8' for steps, '8867-4' for heart rate).",
          "default": null
        },
        "standard_system": {
          "type": ["string", "null"],
          "enum": ["LOINC", "SNOMED-CT", "UCUM", "custom", null],
          "description": "The coding system for standard_code.",
          "default": null
        },
        "standard_display": {
          "type": ["string", "null"],
          "description": "Human-readable display name from the standard vocabulary.",
          "default": null
        },
        "confidence": {
          "type": ["number", "null"],
          "minimum": 0,
          "maximum": 1,
          "description": "Confidence score for the mapping (0.0 to 1.0). 1.0 for deterministic rule-based mappings.",
          "default": null
        },
        "method": {
          "type": ["string", "null"],
          "enum": ["rule", "terminology-lookup", "ai", "manual", null],
          "description": "How the mapping was determined.",
          "default": null
        }
      }
    },
    "quality": {
      "type": "object",
      "description": "Data quality tracking, populated progressively through cleaning, validation, and qualification stages.",
      "additionalProperties": false,
      "properties": {
        "flags": {
          "type": "array",
          "description": "Quality flags accumulated during processing. Each flag identifies a specific quality characteristic or issue.",
          "default": [],
          "items": {
            "type": "object",
            "required": ["code", "severity", "stage"],
            "additionalProperties": false,
            "properties": {
              "code": {
                "type": "string",
                "description": "Machine-readable flag code (e.g., 'MISSING_VALUE', 'OUTLIER_DETECTED', 'TYPE_COERCED', 'EMPTY_DATASET')."
              },
              "severity": {
                "type": "string",
                "enum": ["info", "warning", "error"]
              },
              "message": {
                "type": ["string", "null"],
                "description": "Human-readable description of the issue."
              },
              "stage": {
                "type": "string",
                "description": "Pipeline stage that produced this flag."
              }
            }
          }
        },
        "completeness": {
          "type": ["number", "null"],
          "minimum": 0,
          "maximum": 1,
          "description": "Completeness score (0.0 to 1.0) computed during validation.",
          "default": null
        },
        "plausibility": {
          "type": ["string", "null"],
          "enum": ["pass", "fail", "warn", "unchecked", null],
          "description": "Plausibility assessment result from the Kahn framework validation.",
          "default": null
        }
      }
    },
    "stage": {
      "type": "string",
      "enum": ["raw", "structured", "cleaned", "validated", "qualified", "mapped", "standardized"],
      "description": "Current pipeline stage. Tracks where this event sits in the progressive harmonization pipeline."
    },
    "extensions": {
      "type": ["object", "null"],
      "description": "Escape hatch for source-specific metadata that does not fit elsewhere. Keys should be namespaced by source (e.g., 'fitbit.datasetInterval', 'sleep.isMainSleep').",
      "default": null,
      "additionalProperties": true
    }
  }
}
