[
  {
    "event_id": "d0527e67-35e2-4567-bc23-7666cd067cd4",
    "subject_id": "019686c7-cecd-7558-8018-d55a4ac848c5",
    "timestamp": "2025-04-05T07:39:01.000Z",
    "timestamp_end": null,
    "duration_seconds": null,
    "type": "measurement",
    "category": "body-fat-ratio",
    "granularity": "instant",
    "payload": {
      "raw_value": 22.787,
      "value": 22.787,
      "unit": "%",
      "label": "Fat Ratio",
      "components": null
    },
    "context": {
      "source": "withings",
      "modality": "scale",
      "device": null,
      "source_measurement_type": "Fat Ratio"
    },
    "provenance": {
      "source_record_id": "withings:019686c7-cecd-7558-8018-d55a4ac848c5:6:2025-04-05T07:39:01.000000Z",
      "ingested_at": "2026-04-20T14:30:01.880Z",
      "group_id": "9bb47d2d-0a2f-4a8a-a07a-2aac061c215a",
      "parent_event_id": null,
      "adapter": "withings-body-scale-v1",
      "adapter_version": "1.0.0"
    },
    "mapping": {
      "standard_code": null,
      "standard_system": null,
      "standard_display": null,
      "confidence": null,
      "method": null
    },
    "quality": {
      "flags": [],
      "completeness": null,
      "plausibility": null
    },
    "stage": "structured",
    "extensions": {
      "withings.typeValue": 6,
      "withings.attrib": 0,
      "withings.createdDateTime": "2025-04-05T07:39:43.000000Z",
      "withings.modifiedDateTime": "2025-04-05T07:39:43.000000Z"
    }
  },
  {
    "event_id": "00872d5c-ed81-4b90-a051-ca31885af845",
    "subject_id": "019686c7-cecd-7558-8018-d55a4ac848c5",
    "timestamp": "2025-04-05T07:39:01.000Z",
    "timestamp_end": null,
    "duration_seconds": null,
    "type": "measurement",
    "category": "fat-free-mass",
    "granularity": "instant",
    "payload": {
      "raw_value": 65.94,
      "value": 65.94,
      "unit": "kg",
      "label": "Fat Free Mass",
      "components": null
    },
    "context": {
      "source": "withings",
      "modality": "scale",
      "device": null,
      "source_measurement_type": "Fat Free Mass"
    },
    "provenance": {
      "source_record_id": "withings:019686c7-cecd-7558-8018-d55a4ac848c5:5:2025-04-05T07:39:01.000000Z",
      "ingested_at": "2026-04-20T14:30:01.880Z",
      "group_id": "a3907c5c-b10e-468e-ae85-f02773b1d901",
      "parent_event_id": null,
      "adapter": "withings-body-scale-v1",
      "adapter_version": "1.0.0"
    },
    "mapping": {
      "standard_code": null,
      "standard_system": null,
      "standard_display": null,
      "confidence": null,
      "method": null
    },
    "quality": {
      "flags": [],
      "completeness": null,
      "plausibility": null
    },
    "stage": "structured",
    "extensions": {
      "withings.typeValue": 5,
      "withings.attrib": 0,
      "withings.createdDateTime": "2025-04-05T07:39:43.000000Z",
      "withings.modifiedDateTime": "2025-04-05T07:39:43.000000Z"
    }
  },
  {
    "event_id": "4cb15e24-90be-4b6a-9eec-a96cabe49c18",
    "subject_id": "019686c7-cecd-7558-8018-d55a4ac848c5",
    "timestamp": "2025-04-13T08:48:40.000Z",
    "timestamp_end": null,
    "duration_seconds": null,
    "type": "measurement",
    "category": "weight",
    "granularity": "instant",
    "payload": {
      "raw_value": 84.483,
      "value": 84.483,
      "unit": "kg",
      "label": "Weight",
      "components": null
    },
    "context": {
      "source": "withings",
      "modality": "scale",
      "device": null,
      "source_measurement_type": "Weight"
    },
    "provenance": {
      "source_record_id": "withings:019686c7-cecd-7558-8018-d55a4ac848c5:1:2025-04-13T08:48:40.000000Z",
      "ingested_at": "2026-04-20T14:30:01.884Z",
      "group_id": "f0e66915-5237-49a7-a66d-8b62f4c9a5ec",
      "parent_event_id": null,
      "adapter": "withings-body-scale-v1",
      "adapter_version": "1.0.0"
    },
    "mapping": {
      "standard_code": null,
      "standard_system": null,
      "standard_display": null,
      "confidence": null,
      "method": null
    },
    "quality": {
      "flags": [],
      "completeness": null,
      "plausibility": null
    },
    "stage": "structured",
    "extensions": {
      "withings.typeValue": 1,
      "withings.attrib": 0,
      "withings.createdDateTime": "2025-04-13T08:49:23.000000Z",
      "withings.modifiedDateTime": "2025-04-13T08:49:23.000000Z"
    }
  },
  {
    "event_id": "38d3fa52-cc9f-4d93-bd68-2bb95a8045a0",
    "subject_id": "019686c7-cecd-7558-8018-d55a4ac848c5",
    "timestamp": "2025-04-13T08:48:40.000Z",
    "timestamp_end": null,
    "duration_seconds": null,
    "type": "measurement",
    "category": "fat-mass",
    "granularity": "instant",
    "payload": {
      "raw_value": 18.75,
      "value": 18.75,
      "unit": "kg",
      "label": "Fat Mass Weight",
      "components": null
    },
    "context": {
      "source": "withings",
      "modality": "scale",
      "device": null,
      "source_measurement_type": "Fat Mass Weight"
    },
    "provenance": {
      "source_record_id": "withings:019686c7-cecd-7558-8018-d55a4ac848c5:8:2025-04-13T08:48:40.000000Z",
      "ingested_at": "2026-04-20T14:30:01.884Z",
      "group_id": "8160550c-667e-406f-8357-1109ad24b70f",
      "parent_event_id": null,
      "adapter": "withings-body-scale-v1",
      "adapter_version": "1.0.0"
    },
    "mapping": {
      "standard_code": null,
      "standard_system": null,
      "standard_display": null,
      "confidence": null,
      "method": null
    },
    "quality": {
      "flags": [],
      "completeness": null,
      "plausibility": null
    },
    "stage": "structured",
    "extensions": {
      "withings.typeValue": 8,
      "withings.attrib": 0,
      "withings.createdDateTime": "2025-04-13T08:49:23.000000Z",
      "withings.modifiedDateTime": "2025-04-13T08:49:23.000000Z"
    }
  },
  {
    "event_id": "11f95917-435b-4f56-ba85-61d417d8eab8",
    "subject_id": "019686c7-cecd-7558-8018-d55a4ac848c5",
    "timestamp": "2025-04-13T08:48:40.000Z",
    "timestamp_end": null,
    "duration_seconds": null,
    "type": "measurement",
    "category": "muscle-mass",
    "granularity": "instant",
    "payload": {
      "raw_value": 62.46,
      "value": 62.46,
      "unit": "kg",
      "label": "Muscle Mass",
      "components": null
    },
    "context": {
      "source": "withings",
      "modality": "scale",
      "device": null,
      "source_measurement_type": "Muscle Mass"
    },
    "provenance": {
      "source_record_id": "withings:019686c7-cecd-7558-8018-d55a4ac848c5:76:2025-04-13T08:48:40.000000Z",
      "ingested_at": "2026-04-20T14:30:01.884Z",
      "group_id": "c23580f1-734e-491a-abd4-e204fdba467f",
      "parent_event_id": null,
      "adapter": "withings-body-scale-v1",
      "adapter_version": "1.0.0"
    },
    "mapping": {
      "standard_code": null,
      "standard_system": null,
      "standard_display": null,
      "confidence": null,
      "method": null
    },
    "quality": {
      "flags": [],
      "completeness": null,
      "plausibility": null
    },
    "stage": "structured",
    "extensions": {
      "withings.typeValue": 76,
      "withings.attrib": 0,
      "withings.createdDateTime": "2025-04-13T08:49:23.000000Z",
      "withings.modifiedDateTime": "2025-04-13T08:49:23.000000Z"
    }
  }
]